630774,Vakantietrek naar het water,Vakantiedrukte in Nederland. Drukte op de wegen; met oa auto's met aanhangers waarop fietsen staan. Op de Friese meren varen tientallen boten. De zeilers van de Kaagweek op de Kagerplassen ondervinden hinder van de pleziervaart. Van Asselt wint de race voor 12 voets jollen. Verder drukte in openluchtzwembaden; langs de kust en het Veluwemeer.
631177,Het oude ambacht van de zilversmid,In het Zuid-Hollandse stadje Schoonhoven; al eeuwen lang bekend om zijn zilverwerk; wordt het beroep van zilversmid nog altijd uitgeoefend. Naast de handwerkateliers; waar nog vaak gewerkt wordt naar modellen en motieven die ook vroeger in zwang waren; zijn er in Schoonhoven tal van zilverfabrieken; waar gewerkt wordt met moderne machines volgens de stempels van de vroegere handwerkers. In Schoonhoven staat ook de enige mts in de Benelux die een afgeronde vakopleiding geeft voor goud- en edelsmeden; graveurs en juweliers. SHOTS: cu. gevelsteen zilversmid; zilversmid aan het werk in zijn atelier; vervaardigen antieke zilveren lepeltjes in zilverfabriek; ext. en int. mts Schoonhoven met leerlingen tijdens praktijklessen.
631344,Torenkraanbestuurders op ''school'',Theoretische en praktijkopleiding te Reuver van machinisten voor torenkranen; georganiseerd door de stichting Vakopleiding Bouwbedrijf en de arbeidsinspectie.
637772,Schoolvoetbal in de vakantie,Amsterdamse schooljongens hollen een drassig en modderig weiland op en spelen; na de toss; voetbal. Na afloop van de wedstrijd verlaten de jongens het veld en protesteren beide aanvoerders bij de scheidsrechter. De winnaars verlaten daarna; weer in hun gewone kleren gestoken; het voetbalveld hossend; de verliezers sjokken; idem; wat moedeloos weg.
640371,Bouwspeelplaats voor kinderen,Kinderen spelen in speeltuinen; op grasveldjes tussen flats en op een galerei. In de wijk Hoograven te Utrecht is een bouwspeeltuin gemaakt; waar kinderen met materialen hutten bouwen; in een autobus kunnen knutselen en tafeltennis en biljart spelen. Met commentaar van kinderen over de speeltuin.
6701,Nieuws uit Indonesië: opheffing van het KNIL,Opheffing van het Koninklijk Nederlands Indisch Leger (KNIL): ontbindingsceremonie te Djakarta in de ambtswoning van de Nederlandse Hoge Commissaris; dr. H. Hirschfeld op 26 juli. Tevens een kranslegging (op 25 juli) op de militaire erebegraafplaats Menteng Pulo. SHOTS: 00:02 ONTBINDINGSCEREMONIE: aanwezig zijn oa de Indonesische minister-president Mohammad Hatta en andere vooraanstaande Indonesische politici; een afvaardiging van het KNIL; en hoge burgerlijke en militaire autoriteiten. Toespraak door de commandant van de Nederlandse legerstrijdkrachten in Indonesië; generaal D.C. Buurman van Vreeden (in het Nederlands en het Indonesisch); en Hirschfeld. De laatste deelt oa mede dat Buurman van Vreeden en generaal-majoor D.R.A. van Langen van het KNIL koninklijk worden onderscheiden. 02:46 KRANSLEGGING: ext. gebouwen; militairen staan in de houding of presenteren het geweer; Buurman van Vreeden legt een krans aan de voet van de vlaggemast; de aanwezigen maken een rondgang over het kerkhof; de militairen brengen de militaire groet bij het graf van generaal S.H. Spoor; cu's van enkele grafkruisen.
614834,Concours d'elegance,Automobiel festijn van de KNAC in het Vondelpark Amsterdam. -Totaalshot: paviljoen; publiek; auto's 5"; -div. shots auto's; oa met bloemen versierd; totaal 23"; rijden langzaam voorbij; totaal 1'02" -div. shots toeschouwers; totaal 4"; -div. shots poseren: drie jongetjes in matrozenpak 3"; twee dames met hond 3"; heer en dame 2"; -div. titel(s)/tussentitel(s)
616869,Miniatuur watervliegtuigen,Jan Brink uit Haarlem wint de wedstrijd met radiografisch bestuurbare watervliegtuigen op de Vinkeveense plassen.
617520,60 sinterklazen,Wedstrijd voor Sinterklazen uit heel Nederland in Amsterdam. 60 Sinterklazen nemen deel aan een maaltijd; Leo Schuit; Sinterklaas in Putten; wordt uitgeroepen tot winnaar.
620994,Hardrijden op de schaats voor dames,Wereldkampioenschap allround schaatsen voor vrouwen op ijsbaan Thialf te Heerenveen. De 35-jarige Atje Keulen-Deelstra behaalt haar 4e  wereldtitel. Op de slotdag wint ze de 1000 meter en rijdt een persoonlijk record op de 3 kilometer. De Amerikaanse Sheila Young; eerste na de eerste dag; wordt vierde in het eindklassement. Voor het eerst wordt de kampioen over de baan rondgereden in een arreslee. Met commentaar (buiten beeld) van Keulen-Deelstra voor aanvang van de wedstrijden. - 500 meter: de West-Duitse Monica Pflug 45;43 (4e) - Keulen-Deelstra 45;52 (5e); - 1500 meter: Keulen-Deelstra 2.19;07 (1e); - 1000 meter: Young 1.30;43 (4e); - echtgenoot Jelle Keulen volgt gespannen de wedstrijd; -3km: Keulen-Deelstra 4.49;07 (1e) - Sippie Tigchelaar 4.50;23 (2e); -ereronde in een arreslee over de baan.
621072,Engeland trekt aan langste eind en wint wereldkampioenschap touwtrekken,Op het wereldkampioenschap touwtrekken in het Gelderse Doetinchem wint het Engelse team in de finale van Zwitserland. Tijdens de wedstrijd tussen Nederland en Zuid-Afrika vindt een kleine betoging plaats door mensen die hun kritiek op apartheid laten horen omdat de Zuid-Afrikaanse ploeg alleen uit blanken bestaat. SHOTS: diversen van touwtrekwedstrijden; scheidsrechters geven startsein; bootjes op water met betogers met protestborden tegen apartheid; Zwitserse supporters op tribune maken lawaai met koeienbel.
621414,Hard-arren en ski-jöring,Wedstrijden "hard-arren" te Hoorn en "ski-jöring" te Zandvoort. SHOTS: - div. heren op kleine arresleden achter paard glijden langs belangstellenden die langs de weg staan (met kort shot gefilmd vanaf glijdende arreslee); - div. starts van wedstrijden "hard-arren" en een finish; - wedstrijd; waarbij mensen op ski's door auto's worden voortgetrokken ("ski-jöring"); waarbij oa dame ten val komt.
639420,Waisda? a video labeling game,Waisda? is a Web application that provides a multiplayer video labeling game. It is based on the principles of the ESP image labeling game coined by Louis von Ahn; where two or more users compete with each other by entering tags. In Waisda? players score points by entering the same tag as one of the other players in a ten second interval. As a result each video that is played in the game is annotated with tags that are anchored to a time point in the video. Waisda? was initiated by the Netherlands Institute for Sound and Vision and the VU University Amsterdam in the context of the Dutch project Images for the Future and the European research project PrestoPRIME. The software was pioneered in two pilots using historic archive material as well as recent TV episodes from Dutch broadcasters (KRO and NCRV). The two pilots together resulted in more than a million tags de-scribing thousands of videos. An open source version of Waisda? enables maintainers of an online video collection to start their own crowdsourcing initiative for time-based annotations.    Credits: Direction; editing and audio: Sebastiaan ter Burg. The Netherlands Institute for Sound and Vision safeguards more than 800.;000 hours of television; radio; music and film from 1898 to today; and collects; preserves and opens this audiovisual heritage for as many users as possible: media professionals; education; science and the general public. Images for the Future is a large-scale digitisation project in which four organisations have a large part of the audiovisual heritage of the Netherland through preservation and digitisation. The digitised materials are made as broadly available as possible for education and the general public. The Web & Media group at the VU University Amsterdam investigates storages; linking; enrichment and access to heterogeneous data sources on the Web. Research topics include knowledge and ontology engineering; semantic enrichment; semantic search; interactive and personalized access; visualization paradigms and provenance tracking. PrestoPRIME researched and developed practical solutions for the long-term preservation of digital media objects; programmes and collections; and tried to find ways to increase access by integrating the media archives with European online digital libraries in a digital preservation framework.
639525,Open Culture Data - opening up data: masterclass and a risk-benefit analysis (subtitled),After the first phase of Open Culture Data; which resulted in 8 datasets and 13 apps; we kept getting the same questions from the cultural sector on how to best open up their data and make it available. As a result; a masterclass Open Data for Cultural Organisations was setup up by Creative Commons Netherlands. In the masterclass; 17 participants got answers to practical; technical and legal issues regarding open data. The masterclass was concluded with a hackathon; in which developers got to work with the open culture data. At the same time; Open Culture Data researched what organisations consider to be the most important risks and benefits of open data. We did this together with many different heritage and cultural professionals; both in the masterclass and during a workshop on (open) data by Digital Heritage Netherlands. We based ourself on the 10 risks and 10 benefits of open data  formulated by Europeana; the European digital library. The outcome was that the most important perceived risks are: loss of control; wrong or no attribution; privacy issues with some data; and loss of (potential) income. The main benefits mentioned were: fulfillment of the public mission and finding new channels to end users; enrichment of the data by third parties and the stimulation of reuse. The conclusion was the benefits of open dat outweigh the risks. More information:  http://www.opencultuurdata.nl/about/ and http://mw2013.museumsandtheweb.com/paper/open-culture-data-opening-glam-data-bottom-up/ This video was produced by the  Netherlands Institute for Sound and Vision in collaboration with  Kennisland; as part of the large-scale digitisation project  Images for the Future. The Netherlands Institute for Sound and Vision safeguards more than 800.000 hours of television; radio; music and film from 1898 to today; and collects; preserves and opens this audiovisual heritage for as many users as possible: media professionals; education; science and the general public. Kennisland works on social innovation; gives advice and develops solutions for the issues that crop up during the transformation to a stronger knowledge society. Sound and Vision and Kennisland are both partners in Images for the Future; a large-scale digitisation project in which four organisations have a large part of the audiovisual heritage of the Netherland through preservation and digitisation. The digitised materials are made as broadly available as possible for education and the general public.
639530,Open Culture Data - app competition: results and lessons-learned (subtitled),In order to create interest in the open culture datasets and stimulate reuse; we launched our own app competition that ran from June 16 to December 31; 2012. We set out three main challenges for the developer community: create applications that expand audience reach (online; offline; on site); create applications in which the audience is reached in novel ways; create applications that connect different datasets. We awarded four prizes: three general gold; silver and bronze ones and the National Archives made their own special prize available. We participated on two hackathon events organized by Hack de Overheid in June and October 2012; and a smaller one specifically aimed at reuse of the data in games right before the December 31 deadline. Furthermore; many presentations to raise awareness of the competition and Open Culture Data itself were held; for instance at a developers conference; the Wikimedia Netherlands conference; and Communication and Media Design students made apps as part of their courses. In total; twenty-seven apps were submitted for the competition. The four that won were:  Gold prize:  Muse app; developed by Femke van der Ster; Jelle van der Ster; and Peter Henkes of No strings. Silver prize:  Histagram; developed by Richard Jong of Frontwise. Bronze prize winner:  SimMuseum; developed by Hay Kranen. National Archives prize:  Tijdbalk.nl; developed by Arjan den Boer. Lessons-learned of our own app competition is that firstly: it doesn’t just happen. It will always take time and resources to get the results that we did. Secondly; more needs to be done to make sure that app competitions result in something sustainable. To this end; we’re talking with the developers of Muse App; to see how we van validate their competiton win by creating interest in the app and further develop it within the Dutch cultural sector. Finally we learned that not all data is equally popular: fourteen of the thirty-four available datasets were actually used. The Rijksmuseum and National Archives press photo datasets are well-known collection; contain hundreds of thousands of high-quality images; and have an easy-to-use API; and were the most popular. More information:  http://www.opencultuurdata.nl/about/ and  http://mw2013.museumsandtheweb.com/paper/open-culture-data-opening-glam-data-bottom-up/ This video was produced by the  Netherlands Institute for Sound and Vision in collaboration with  Kennisland; as part of the large-scale digitisation project  Images for the Future. The Netherlands Institute for Sound and Vision safeguards more than 800.000 hours of television; radio; music and film from 1898 to today; and collects; preserves and opens this audiovisual heritage for as many users as possible: media professionals; education; science and the general public. Kennisland works on social innovation; gives advice and develops solutions for the issues that crop up during the transformation to a stronger knowledge society. Sound and Vision and Kennisland are both partners in Images for the Future; a large-scale digitisation project in which four organisations have a large part of the audiovisual heritage of the Netherland through preservation and digitisation. The digitised materials are made as broadly available as possible for education and the general public.
